{
  "id": "generic-linux",
  "name": "通用 Linux 只读识别与采集",
  "version": "1.0.0",
  "officialSource": "https://www.kernel.org/doc/html/latest/",
  "commands": [
    {
      "id": "generic-linux-uname-a",
      "title": "读取内核与系统信息",
      "targetCategory": "Server",
      "commandText": "uname -a",
      "verificationStatus": "Verified",
      "isReadOnly": true,
      "vendor": null,
      "productFamily": null,
      "minimumVersion": null,
      "maximumVersion": null,
      "checkItem": "基础识别",
      "modelRange": "*",
      "accountRequirement": "只读审计账户",
      "riskLevel": "Low",
      "timeoutSeconds": 30,
      "pagingBehavior": "NotApplicable",
      "resultDescription": "确认内核、主机名和体系结构。",
      "verificationDate": "2026-07-16",
      "officialSource": "https://www.gnu.org/software/coreutils/manual/html_node/uname-invocation.html"
    },
    {
      "id": "generic-linux-os-release",
      "title": "读取发行版信息",
      "targetCategory": "Server",
      "commandText": "cat /etc/os-release",
      "verificationStatus": "Verified",
      "isReadOnly": true,
      "vendor": null,
      "productFamily": null,
      "minimumVersion": null,
      "maximumVersion": null,
      "checkItem": "基础识别",
      "modelRange": "*",
      "accountRequirement": "只读审计账户",
      "riskLevel": "Low",
      "timeoutSeconds": 30,
      "pagingBehavior": "NotApplicable",
      "resultDescription": "确认 Linux 发行版名称与版本。",
      "verificationDate": "2026-07-16",
      "officialSource": "https://www.freedesktop.org/software/systemd/man/latest/os-release.html"
    },
    {
      "id": "generic-linux-hostname",
      "title": "读取主机名",
      "targetCategory": "Server",
      "commandText": "hostname",
      "verificationStatus": "Verified",
      "isReadOnly": true,
      "vendor": null,
      "productFamily": null,
      "minimumVersion": null,
      "maximumVersion": null,
      "checkItem": "基础识别",
      "modelRange": "*",
      "accountRequirement": "只读审计账户",
      "riskLevel": "Low",
      "timeoutSeconds": 30,
      "pagingBehavior": "NotApplicable",
      "resultDescription": "确认主机名。",
      "verificationDate": "2026-07-16",
      "officialSource": "https://man7.org/linux/man-pages/man1/hostname.1.html"
    }
  ]
}
