{
  "id": "database-host-discovery-linux",
  "name": "Linux 数据库主机只读发现",
  "version": "1.1.0",
  "officialSource": "https://www.freedesktop.org/software/systemd/man/latest/",
  "commands": [
    {
      "id": "database-host-discovery-linux-processes",
      "title": "读取进程名称",
      "targetCategory": "Server",
      "commandText": "ps -eo pid,comm",
      "verificationStatus": "Verified",
      "isReadOnly": true,
      "vendor": null,
      "productFamily": null,
      "minimumVersion": null,
      "maximumVersion": null,
      "checkItem": "数据库主机发现",
      "modelRange": "*",
      "accountRequirement": "只读审计账户",
      "riskLevel": "Low",
      "timeoutSeconds": 30,
      "pagingBehavior": "NotApplicable",
      "resultDescription": "仅读取当前进程的 PID 和命令名，用于识别已运行的数据库进程；不读取可能包含密码的启动参数。",
      "verificationDate": "2026-07-17",
      "officialSource": "https://gitlab.com/procps-ng/procps/-/blob/master/man/ps.1"
    },
    {
      "id": "database-host-discovery-linux-services",
      "title": "读取运行中的系统服务",
      "targetCategory": "Server",
      "commandText": "systemctl list-units --type=service --state=running --no-pager",
      "verificationStatus": "Verified",
      "isReadOnly": true,
      "optional": true,
      "vendor": null,
      "productFamily": null,
      "minimumVersion": null,
      "maximumVersion": null,
      "checkItem": "数据库主机发现",
      "modelRange": "*",
      "accountRequirement": "只读审计账户",
      "riskLevel": "Low",
      "timeoutSeconds": 30,
      "pagingBehavior": "NotApplicable",
      "resultDescription": "列出当前运行的 systemd 服务，用于识别本机数据库服务；目标系统未使用 systemd 时允许跳过。",
      "verificationDate": "2026-07-16",
      "officialSource": "https://www.freedesktop.org/software/systemd/man/latest/systemctl.html"
    },
    {
      "id": "database-host-discovery-linux-docker-containers",
      "title": "读取 Docker 运行容器元数据",
      "targetCategory": "Server",
      "commandText": "docker ps --no-trunc --format '{\"Image\":{{json .Image}},\"Names\":{{json .Names}},\"Ports\":{{json .Ports}}}'",
      "verificationStatus": "Verified",
      "isReadOnly": true,
      "optional": true,
      "vendor": null,
      "productFamily": null,
      "minimumVersion": null,
      "maximumVersion": null,
      "checkItem": "数据库主机发现",
      "modelRange": "*",
      "accountRequirement": "只读审计账户；账户需具备读取 Docker 容器列表的权限",
      "riskLevel": "Low",
      "timeoutSeconds": 30,
      "pagingBehavior": "NotApplicable",
      "resultDescription": "仅以 JSON 行读取运行中 Docker 容器的镜像、名称和端口；不读取命令、标签或环境变量，Docker 未安装时允许跳过。",
      "verificationDate": "2026-07-17",
      "officialSource": "https://docs.docker.com/reference/cli/docker/container/ls"
    },
    {
      "id": "database-host-discovery-linux-podman-containers",
      "title": "读取 Podman 运行容器元数据",
      "targetCategory": "Server",
      "commandText": "podman ps --no-trunc --format '{\"Image\":{{json .Image}},\"Names\":{{json .Names}},\"Ports\":{{json .Ports}}}'",
      "verificationStatus": "Verified",
      "isReadOnly": true,
      "optional": true,
      "vendor": null,
      "productFamily": null,
      "minimumVersion": null,
      "maximumVersion": null,
      "checkItem": "数据库主机发现",
      "modelRange": "*",
      "accountRequirement": "只读审计账户；账户需具备读取 Podman 容器列表的权限",
      "riskLevel": "Low",
      "timeoutSeconds": 30,
      "pagingBehavior": "NotApplicable",
      "resultDescription": "仅以 JSON 行读取运行中 Podman 容器的镜像、名称和端口；不读取命令、标签或环境变量，Podman 未安装时允许跳过。",
      "verificationDate": "2026-07-17",
      "officialSource": "https://docs.podman.io/en/latest/markdown/podman-ps.1.html"
    }
  ]
}
